{
  "$schema": "https://project-atlantis.invalid/schemas/gba-runtime-case.schema.json",
  "format_version": 1,
  "case_id": "b3tj.state7.selected-record",
  "description": "Bounded clean-ROM state7-to-selected-record consumer gate; runtime proof remains unexercised until an owned mGBA listener is available.",
  "provenance": {
    "evidence_level": "natural",
    "rom_revision": "B3TJ-rev00",
    "static_callpath": "research/m2-state7-static-callpath-20260816.md",
    "selected_record": "sjis:0x146EE0",
    "text_consumer_status": "unproven",
    "source_separation": "ROM and runtime reports stay local; committed file contains metadata only."
  },
  "rom": {
    "sha256": "d083d66b818b1353a449af7f1dd4232b490c254a4107951a3749973d03a0a394",
    "size": 16777216,
    "game_code_hex": "4233544a"
  },
  "static": {
    "regions": [
      {"id": "selected-record-span", "offset": "0x146EE0", "length": 5, "policy": "observe"},
      {"id": "selected-record-adjacent-guard", "offset": "0x146EDB", "length": 5, "policy": "observe"}
    ],
    "records": [
      {
        "id": "sjis-0x146ee0-boundary",
        "offset": "0x146EE0",
        "allocated_length": 5,
        "unit_bytes": 1,
        "terminator": 0,
        "allowed_values": [[0, 255]],
        "preserve_controls": false
      }
    ]
  },
  "runtime": {
    "required_capabilities": [
      "gdb-remote",
      "register-read",
      "memory-read",
      "breakpoint",
      "watchpoint",
      "register-write",
      "keyinput-consumer-hook",
      "render-bg",
      "render-oam"
    ],
    "gdb_timeout_seconds": 30,
    "connect_timeout_seconds": 10,
    "actions": [
      {"id": "state-dispatch-entry", "op": "breakpoint", "address": "0x08005ECC", "timeout_seconds": 30},
      {
        "id": "boot-receipt",
        "op": "capture",
        "regions": [{"id": "state-bytes", "address": "0x02000000", "length": 3}],
        "renders": [
          {"id": "bg0", "kind": "bg", "bg": 0, "map_width": 32, "map_height": 32},
          {"id": "oam", "kind": "oam", "mapping": "auto"}
        ]
      },
      {"id": "state4-input-entry", "op": "breakpoint", "address": "0x0800A050", "timeout_seconds": 30},
      {"id": "normal-start", "op": "keys", "keys": ["START"], "destination_register": "r1", "hold_reads": 1, "release_reads": 3, "per_read_timeout_seconds": 30},
      {"id": "a1ac-entry", "op": "breakpoint", "address": "0x0800A1AC", "timeout_seconds": 30},
      {"id": "normal-a", "op": "keys", "keys": ["A"], "destination_register": "r1", "hold_reads": 1, "release_reads": 3, "per_read_timeout_seconds": 30},
      {"id": "state7-entry", "op": "breakpoint", "address": "0x080A85D8", "timeout_seconds": 30},
      {"id": "parser-entry", "op": "breakpoint", "address": "0x080025CC", "timeout_seconds": 30, "register_regions": [{"id": "r1-source-candidate", "register": "r1", "offset": 0, "length": 2}]},
      {"id": "selected-record-read", "op": "watchpoint", "address": "0x08146EE0", "length": 2, "watch_type": 3, "timeout_seconds": 30},
      {
        "id": "selected-record-consumer-receipt",
        "op": "capture",
        "regions": [
          {"id": "state-bytes", "address": "0x02000000", "length": 3},
          {"id": "iwram-head", "address": "0x03000000", "length": 256}
        ],
        "renders": [
          {"id": "bg0", "kind": "bg", "bg": 0, "map_width": 32, "map_height": 32},
          {"id": "oam", "kind": "oam", "mapping": "auto"}
        ]
      }
    ]
  }
}
